{
  "$schema": "https://json-schema.org/draft/2020-12/schema",
  "$id": "upme_solar/municipality_stats.schema.json",
  "title": "Municipality Aggregated Stats",
  "description": "Resultado agregado por (municipio PDET, fuente). Se popula en la Semana 4.",
  "type": "object",
  "required": [
    "_id",
    "divipola",
    "mpio_cnmbr",
    "source",
    "building_count",
    "total_roof_area_m2",
    "mean_roof_area_m2",
    "median_roof_area_m2",
    "coverage_ratio",
    "computed_at"
  ],
  "additionalProperties": false,
  "properties": {
    "_id": {
      "type": "string",
      "pattern": "^[0-9]{5}:(microsoft|google|tum)$",
      "description": "Clave compuesta divipola:source."
    },
    "divipola": { "type": "string", "pattern": "^[0-9]{5}$" },
    "mpio_cnmbr": { "type": "string", "minLength": 1 },
    "source": { "enum": ["microsoft", "google", "tum"] },
    "building_count": { "type": "integer", "minimum": 0 },
    "total_roof_area_m2": { "type": "number", "minimum": 0 },
    "mean_roof_area_m2": { "type": "number", "minimum": 0 },
    "median_roof_area_m2": { "type": "number", "minimum": 0 },
    "coverage_ratio": { "type": "number", "minimum": 0, "maximum": 1 },
    "computed_at": { "type": "string", "format": "date-time" }
  }
}
